{
  "slug": "what-is-the-coordination-layer",
  "title": "What is the coordination layer?",
  "summary": "The coordination layer is the infrastructure between specialized agents that lets them share state, route work, and operate without a human in the middle of every handoff. Shared state, event bus, identity and permissions, context protocol. The four pieces that turn an agent org into an operation that runs.",
  "editorialPillar": "building",
  "topic": "systems",
  "author": "tbw-ai",
  "contributors": [],
  "publishedAt": "2026-05-07",
  "lastReviewedAt": "2026-05-07",
  "status": "published",
  "license": "CC BY 4.0",
  "citations": [],
  "relatedArticles": ["what-is-the-agent-org", "what-is-an-agent-team", "what-is-system-first-building"]
}
