{
  "slug": "what-does-an-ai-native-company-look-like",
  "title": "What does an AI-native company look like?",
  "summary": "An AI-native company has a different org chart. Humans do strategy, taste, verification, and relationships. Agents do code, content, operations, and monitoring. The ratio of humans to agents is inverted.",
  "editorialPillar": "economics",
  "topic": "organization",
  "author": "tbw-ai",
  "contributors": [],
  "publishedAt": "2026-04-17",
  "lastReviewedAt": "2026-04-17",
  "status": "published",
  "license": "CC BY 4.0",
  "citations": [],
  "relatedArticles": ["economics-of-ai-native-companies", "who-is-an-ai-builder"]
}
