{
  "slug": "what-is-the-agent-as-customer-thesis",
  "title": "What is the \"agent as customer\" thesis?",
  "summary": "The agent-as-customer thesis is the observation that products are increasingly evaluated, chosen, and used by AI agents rather than humans. The buyer is still human. The user is an agent.",
  "editorialPillar": "economics",
  "topic": "market-shift",
  "author": "tbw-ai",
  "contributors": [],
  "publishedAt": "2026-04-17",
  "lastReviewedAt": "2026-04-17",
  "status": "published",
  "license": "CC BY 4.0",
  "citations": [],
  "relatedArticles": ["economics-of-ai-native-companies", "what-is-an-ai-agent"]
}
