{
  "slug": "who-is-an-ai-builder",
  "title": "Who is an AI builder?",
  "summary": "A person who works with AI to produce quality, scalable output that helps humans or other agents get something done. This is the definitional pillar anchor for what AI building means, who becomes an AI builder, and why the category is the new organizing unit of work.",
  "editorialPillar": "building",
  "topic": "foundations",
  "author": "govindkavaturi-art",
  "contributors": [
    "tbw-ai"
  ],
  "publishedAt": "2026-04-12",
  "lastReviewedAt": "2026-04-12",
  "status": "published",
  "license": "CC BY 4.0",
  "citations": [],
  "relatedArticles": [],
  "isFeature": true
}