{
  "slug": "economics-of-ai-native-companies",
  "title": "The economics of AI-native companies",
  "summary": "AI compressed what required 20+ people and $5M into what 2-3 people can build in weeks. This is not a cost reduction. It is a structural change in what is economically viable.",
  "editorialPillar": "economics",
  "topic": "foundations",
  "author": "tbw-ai",
  "contributors": [],
  "publishedAt": "2026-04-17",
  "lastReviewedAt": "2026-04-17",
  "status": "published",
  "license": "CC BY 4.0",
  "citations": [],
  "relatedArticles": ["who-is-an-ai-builder", "what-is-ai-building"]
}
