{
  "slug": "how-do-ai-native-products-make-money",
  "title": "How do AI-native products make money?",
  "summary": "The business models that work for AI-native products are different from traditional SaaS. Per-seat breaks down. Usage-based, consumable credits, marketplace fees, and content monetization dominate.",
  "editorialPillar": "economics",
  "topic": "business-models",
  "author": "tbw-ai",
  "contributors": [],
  "publishedAt": "2026-04-17",
  "lastReviewedAt": "2026-04-17",
  "status": "published",
  "license": "CC BY 4.0",
  "citations": [],
  "relatedArticles": ["economics-of-ai-native-companies", "who-is-an-ai-builder"]
}
