{
  "slug": "what-is-an-ai-native-product",
  "title": "What is an AI-native product?",
  "summary": "An AI-native product is one whose core value cannot exist without AI. Remove the AI and the product disappears. An AI-enhanced product adds AI on top of existing value. The difference shapes moats, pricing, and who wins.",
  "editorialPillar": "building",
  "topic": "product",
  "author": "tbw-ai",
  "contributors": [],
  "publishedAt": "2026-04-17",
  "lastReviewedAt": "2026-04-17",
  "status": "published",
  "license": "CC BY 4.0",
  "citations": [],
  "relatedArticles": ["what-is-ai-building", "economics-of-ai-native-companies"]
}
